{
  "apiVersion": "sct.socioprophet.org/v0.1",
  "kind": "SCTControlProfile",
  "metadata": {
    "name": "semk-default-audience-pass",
    "version": "0.1.0",
    "issuedAt": "2026-01-01T00:00:00Z",
    "expiresAt": "2027-01-01T00:00:00Z",
    "issuer": "urn:socioprophet:agentplane:semantic-control",
    "audience": [
      "agentplane-ci",
      "agentplane-runtime"
    ],
    "keyId": "semk-test-key-1",
    "profileSha256": "62a0d0c56b10d79c5af10210cd959c2922399e9931f1426a3f4f592c93c76f80",
    "signatureRef": "urn:socioprophet:signature:semk-test-key-1:valid"
  },
  "spec": {
    "motifs": [
      {"name": "gate", "weight": 1.0},
      {"name": "neck", "weight": 0.8},
      {"name": "chapel", "weight": 0.7}
    ],
    "runtimeProjection": {
      "lane": "staging",
      "plannerBranchBudget": 3,
      "toolBudget": 3,
      "memoryScope": "local-only",
      "disclosureScope": "bounded",
      "handoffPolicy": "mediated",
      "interruptPolicy": "standard",
      "humanGateRequired": false,
      "breakGlassAllowed": false,
      "maxRunSeconds": 600,
      "auditMode": "strict"
    },
    "delivery": {
      "mode": "mcp-sidecar",
      "authorizedAudience": [
        "agentplane-ci",
        "agentplane-runtime"
      ],
      "failClosed": true,
      "redactionMode": "hash-only"
    },
    "deconfliction": {
      "breakGlassAllowed": false,
      "breakGlassReasonRequired": false,
      "unauthorizedTelemetry": true,
      "replayBindProfileHash": true
    },
    "replayPolicy": {
      "bindSameHash": true,
      "allowAuthorizedSuccessor": false,
      "successorProofRequired": true
    },
    "failMode": "deny"
  }
}
